{
  "accounts": [
    {
      "name": "Demo checking account",
      "description": null,
      "currency": "EUR",
      "iban": null,
      "bic": null,
      "number": null,
      "type": "default"
    },
    {
      "name": "Groceries are us",
      "description": null,
      "currency": "EUR",
      "iban": null,
      "bic": null,
      "number": null,
      "type": "creditor"
    },
    {
      "name": "Boss & Co.",
      "description": null,
      "currency": "EUR",
      "iban": null,
      "bic": null,
      "number": null,
      "type": "debtor"
    }
  ],
  "rules": [
    {
      "name": "Income locator",
      "description": null,
      "restrictive": true,
      "active": true,
      "sort": 0,
      "group": null,
      "conditions": [
        {
          "field": "AMOUNT",
          "operation": "MORE_THAN",
          "value": "2000"
        },
        {
          "field": "AMOUNT",
          "operation": "LESS_THAN",
          "value": "5000"
        },
        {
          "field": "DESCRIPTION",
          "operation": "CONTAINS",
          "value": "Salary"
        }
      ],
      "changes": [
        {
          "field": "CATEGORY",
          "value": "Salary"
        }
      ]
    },
    {
      "name": "Groceries matcher",
      "description": null,
      "restrictive": true,
      "active": true,
      "sort": 0,
      "group": null,
      "conditions": [
        {
          "field": "DESCRIPTION",
          "operation": "CONTAINS",
          "value": "grocery"
        },
        {
          "field": "AMOUNT",
          "operation": "MORE_THAN",
          "value": "20"
        },
        {
          "field": "AMOUNT",
          "operation": "LESS_THAN",
          "value": "90"
        }
      ],
      "changes": [
        {
          "field": "CATEGORY",
          "value": "Groceries"
        },
        {
          "field": "TO_ACCOUNT",
          "value": "Groceries are us"
        }
      ]
    }
  ],
  "categories": [
    {
      "label": "Salary",
      "description": "Income by salary"
    },
    {
      "label": "Groceries",
      "description": "Spending on groceries"
    },
    {
      "label": "Car",
      "description": "Spending on car"
    }
  ],
  "budgetPeriods": [],
  "contracts": [],
  "tags": []
}
